index,Name,DOI,Abstract,cluster,TSNE1,TSNE2
42,Wind speed forecasting based on the hybrid ensemble empirical mode decomposition and GA-BP neural network method,http://dx.doi.org/10.1016/j.renene.2016.03.103,abstractwind speed major factor affect wind generation turn forecasting accuracy wind speed key wind power prediction paper wind speed forecasting based improved empirical mode decomposition ga neural network proposed applied extensively analyzing nonlinear stochastic signal ensemble empirical mode decomposition eemd improved effectively handle mode mixing decompose original data stationary signal different frequency signal taken data ga neural network final forecasted wind speed data obtained aggregating predicted data individual signal case study awind farmin inner mongolia show proposed hybrid much accurate traditional ga forecasting approach ga wavelet neural network sensitivity parameter seen appropriate setting parameter improve forecasting simulation matlab show proposed improve forecasting accuracy computational make suitable ultra short min short h wind speed forecasting,2,12.978726,-1.3563902
43,ERA5: The new champion of wind power modelling?,http://dx.doi.org/10.1016/j.renene.2018.03.056,abstractoutput meteorologicalreanalysesare used extensively academia modelling wind power recently first batch new released main purpose paper compare performance commonly used today term modelling aggregated wind generation five different country ii generation individualwind turbinesin sweden modelledwind power generationwas compared measurement conclusion performs better analysed aspect correlation higher mean absolute androot mean square errorsare average around lower distribution hourly data change hourly data similar measurement also shown related long correction using one measurement data predict energy remaining year lower fact using one data give slightly accurate estimate using two year data additionally new metric quantifying system size dispersion wind farm proposed,2,10.081656,-2.0755992
44,"Feasibility study of an islanded microgrid in rural area consisting of PV, wind, biomass and battery energy storage system",http://dx.doi.org/10.1016/j.enconman.2016.09.046,abstractrenewable energy system proving promising environment friendly source electricity generation particularly country inadequate fossil fuel resource recent year wind solar photovoltaic pv biomass based system drawing attention provide electricity isolated energy deficient region paper present hybrid pv wind generation system along biomass storage fulfill electrical load small area optimal sizing component recently introduced based artificial bee colony algorithm applied verify strength proposed result compared result obtained standard software tool hybrid electric renewable homer particle pso algorithm verified result algorithm convergence property ability provide quality result critical case failure source behavior proposed system observed evident result proposed scheme manage smooth power flow optimal configuration,2,9.506653,1.3596296
45,Real-Time Energy Storage Management for Renewable Integration in Microgrid: An Off-Line Optimization Approach,http://dx.doi.org/10.1109/TSG.2014.2359004,abstract microgrid key enabling future grid integrating distributed renewable generator storage system efficiently serve local however due random intermittent characteristic renewable energy new challenge arise reliable operation microgrids address issue study paper energy management single microgrid system constitutes renewable generation system energy storage system aggregated load renewable energy offset load termed net energy profile practically predictable finite error arbitrarily distributed aim minimize total energy cost modeled sum varying strictly convex function conventional energy drawn main finite horizon jointly optimizing energy charged discharged storage system subject practical load storage constraint solve propose new approach devise online algorithm approach first assume net energy profile perfectly predicted known derive optimal energy scheduling closed form next inspired optimal propose sliding window based online algorithm energy management practical setup noisy predicted net energy profile arbitrary error finally conduct simulation based wind generation data ireland power system evaluate performance proposed algorithm compared heuristically designed algorithm well conventional dynamic programming based,2,8.192209,3.8777547
46,Techno-economic optimization of hybrid photovoltaic/wind generation together with energy storage system in a stand-alone micro-grid subjected to demand response,http://dx.doi.org/10.1016/j.apenergy.2017.05.116,abstractregarding importance supplying energy region far power system study devoted analyzing modeling stand alone spite many study case programming optimal management operation cost reduction grid regarding importance size grid paper seek examine investigate ability programming case size due deficiency unavailability dispatchable energy recourse nondispatchable renewable energy resource wind solar energy considered supply required energy applied strategy effective size well relevant cost reduction implemented reducing eliminating mismatch generation consumption profile shift schedule dispatchable load furthermore effect utilization loss generated energy reduction studied optimized result without extracted compared case optimum configuration determined obtained result indicated program reduced number required battery required inverter photovoltaic cell capacity consequently total net present cost furthermore implementation reduced peak consumed load increased consumed load factor correlation factor component modeled mathematically within framework mixed integer linear programming program performed homer software together gam software via cplex solver,2,8.06927,2.3892481
47,Optimal Prediction Intervals of Wind Power Generation,http://dx.doi.org/10.1109/TPWRS.2013.2288100,abstract accurate reliable wind power forecasting essential power system operation given significant uncertainty involved wind generation probabilistic interval forecasting provides unique estimate quantify potential impact risk facing system operation wind penetration beforehand paper proposes novel hybrid intelligent algorithm approach directly formulate optimal prediction interval wind power generation based extreme machine particle prediction interval associated confidence level generated direct coverage probability sharpness ensure quality proposed involve statistical inference distribution assumption forecasting error needed existing method case study using wind farm data australia conducted comparing benchmark applied experimental result demonstrate high reliability developed approach therefore convinced proposed provides new generalized framework probabilistic wind power forecasting high reliability flexibility high potential practical application power system,2,12.525212,-0.6560611
48,Role of power-to-gas in an integrated gas and electricity system in Great Britain,http://dx.doi.org/10.1016/j.ijhydene.2015.03.004,abstractpower gas ptg convert electricity hydrogen using electrolysis process us gas storage transport hydrogen hydrogen injected gas network quantity quality compatible thegas safetyregulations thereby transported mixture hydrogen natural gas centre integrated electricity network ptg systemscan provide flexibility thepower systemand absorb excess electricity renewables toproduce hydrogen injection hydrogen gas network reduces gas volume supplied terminal order investigate concept hydrogenelectrolyserswere included option within optimisation great britain combined gas electricity network cgen used determine minimum cost meeting electricity gas typical low high electricity presence significant capacity wind generation value employing power gas system gas andelectricity supply systemwas investigated given differentallowable levelsof hydrogen injection result showed thatproducing hydrogenfrom electricity capable reducing windcurtailmentin high wind case decreasing overall cost gas electricity network northern part identified suitable region develop hydrogen electrolysis injection facility due vicinity significant capacity wind generation well existence gas network headroom capacity expected increase depletion uk domestic gas resource,4,-0.5596503,8.442359
49,Dealing with multiple decades of hourly wind and PV time series in energy models: A comparison of methods to reduce time resolution and the planning implications of inter-annual variability,http://dx.doi.org/10.1016/j.apenergy.2017.03.051,abstractusing high resolution planning great britain power system year simulated wind pv generation data study compare different method reduce resolution energy model increase computational tractability downsampling clustering heuristic comparing result term cost installed capacity across different method study show best depends heavily data setup constraint implies one size fit approach reduction approach appear promising addition year series demonstrate considerable inter variability wind pv power output complicates detail energy model suggests long series necessary result high share pv wind generation using single year data likely unreliable better modeling planning method required determine robust scenario high share variable renewables method implemented freely available open source modeling framework calliope,2,10.379453,-1.1129543
50,The merit-order effect in the Italian power market: The impact of solar and wind generation on national wholesale electricity prices,http://dx.doi.org/10.1016/j.enpol.2014.11.038,abstractitaly promoted one generous renewable support scheme worldwide resulted high increase solar power generation analyze italian electricity finding empirical evidence merit order effect increase gwh hourly average daily solar wind source average reduced electricity price respectively mwh mwh amplified volatility price decreased correspondence increase solar wind electricity estimate solar generated higher saving wind mainly former prominent latter however solar case saving sufficient compensate cost related supporting scheme entirely internalized within end user tariff causing reduction consumer surplus opposite occurs case wind,7,5.094652,1.5843868
51,The Impact of Economic Corridor and Tourism on Local Community's Quality of Life under One Belt One Road Context,http://dx.doi.org/10.1177/0193841X231182749,economic corridor unlock new economic opportunity tourism development region achieve sustainable development goal green economic growth conducive environmental sustainability economic mega project cpec promote tourism lead community well better quality life modern infrastructure development contributes significantly economic growth tourism activity study objective emphasize exploring tourism sustainable development pursuit obor economic project open door improving resident quality life growing world eyewitness continuous rise emission severe consequence humankind necessary show leading factor tourism economic activity causing environmental pollution rather blame policymakers undoubtedly many study previously focused demonstrating influence socio economic factor lead better environmental quality however empirical literature tourism social well foreign direct investment environment belt road developed economy needed improvement research applied series advanced estimator help demonstrate study probable result study explores role social well hdi tourism development fdi renewable energy information communication ict urbanization co emission belt road bri developed economy estimated result exhibited significant contribution ict renewable energy sustainability besides fdi contributes emission reduction threshold level conversely urbanization tourism activity contribute environmental pollution study outcome stated inverted ekc u shaped hypothesis related specified economy finally based h panel causality test construct exciting result present study concludes economic corridor play vital role tourism development community well sdgs goal sustainable development environmental safety finding suggest essential applicable policy attain desired sustainability level finding contribute literature tourism well sustainability study insight using methodology,3,-7.435281,-10.742958
52,Applications of Green Synthesized Metal Nanoparticles - a Review,http://dx.doi.org/10.1007/s12011-023-03645-9,green nanotechnology emerging science focus nanoparticles living cell biological pathway topic play extremely imperative responsibility various field including pharmaceutical nuclear energy fuel energy electronics bioengineering biological process green synthesis tool suitable develop nanoparticles ranging nm compared related method owing safety eco friendliness non toxicity cost effectiveness particular metal nanoparticles synthesized top bottom approach various technique like physical chemical biological method characterization vital confirmation nanoparticle trait done various instrumentation analysis uv vi spectrophotometry uv vi fourier transform infrared spectroscopy ft ir scanning electron microscope sem transmission electron microscopy tem x ray diffraction xrd atomic force microscopy afm annular dark haadf intracranial pressure icp provide especially information green synthesized metal nanoparticles helpful improve biomedical environmental application particular method condition plant based synthesis characterization technique application green silver gold iron selenium copper nanoparticles overviewed,0,-7.589586,-3.5353417
53,The reformation of catalyst: From a trial-and-error synthesis to rational design,http://dx.doi.org/10.1007/s12274-023-6037-8,appropriate catalyst accelerate reaction rate effectively boost efficient conversion various molecule great importance study chemistry chemical energy material environmental science therefore efficient environmentally friendly easy operate synthesis method used prepare various type catalyst although previous study reported synthesis characterization aforementioned catalyst still remain trial method without depth consideration improvement traditional synthesis method comprehensively summarize compare preparation method trial synthesis strategy structure activity relationship density functional theory dft guided catalyst rational design nanomaterials atomically dispersed catalyst also discus detail utilization nanomaterials single atom catalyst converting small molecule h co n etc value added product driven electrocatalysis photocatalysis thermocatalysis finally challenge outlook preparation efficient green catalyst conventional trial synthesis dft theory featured accordance current development,0,-10.585829,-1.3462303
54,A review of carbon dots in synthesis strategy,http://dx.doi.org/10.1016/j.ccr.2023.215468,abstractamong carbon nanomaterials family fluorescent carbon emerged significant member among novel type nanomaterials many researcher introduced study property potential application carbon dot cd numerous outstanding characteristic photostability negligible cytotoxicity exceptional biocompatibility effortless modification chemical inertness found extensive application various domain including limited cell vivo drug delivery fluorescence sensing photocatalysis polychromatic light emitting diode led energy conversion storage etc recently many synthesis strategy carbon dot developed synthesize controlled way still challenging focus article provide overview advancement made carbon dot particular attention given synthesis technique along discussion provide reference controllable synthesis selection carbon dot,0,-9.624216,-2.85664
55,Race to carbon neutrality in South Africa: What role does environmental technological innovation play?,http://dx.doi.org/10.1016/j.apenergy.2023.122212,abstractgovernments worldwide prioritized carbon reduction neutrality address escalating threat climate change goal united nation sustainable development goal unsdg goal stress taking action climate change lessen bad effect human activity using fossil fuel energy end present study investigates connection conventional energy usage agricultural practice economic growth environmental sustainability south africa additionally explores role renewable energy consumption environmental technological mitigating effect achieve study objective carbon income function fitted annual frequency data present study leverage pesaran autoregressive distributed lag ardl robustness dynamic ardl simulation simultaneously explore short long run coefficient study outlined variable empirical confirmed bound testing cointegration reveals long equilibrium relationship among variable considered notably economic growth fossil fuel energy consumption agricultural activity adverse effect environmental sustainability south africa indicating trade economic growth environmental quality dynamic ardl simulation provide evidence environmental kuznets curve ekc phenomenon however renewable energy consumption environmental technological positively influence environmental quality finding highlight imperative south africa stakeholder adopt green growth policy transition cleaner energy alternative,1,-6.3156815,-9.086038
56,"Toward fostering environmental innovation in OECD countries: Do fiscal decentralization, carbon pricing, and renewable energy investments matter?",http://dx.doi.org/10.1016/j.gr.2023.03.002,abstractenvironmental integral part sustainable development goal also provides foundation green energy thus indirectly support accomplishment notably energy transition fossil fuel renewables critical achieving sustainable development cleaner environment therefore study explores major driving force environmental oecd country incorporating environmental carbon pricing policy budget renewable energy development regional authority financial development globalization recently proposed quantile via movement methodology employed address spiral dependence explanatory variable obtain result different quantiles finding quantile via movement reveal enhancing environmental strengthening carbon pricing policy encourage environmental moreover country decentralize policymaking delegate authority region alongside policymaking encouraging private sector budget renewable energy development necessary stringent policy regulation regional level enhance domestic industry concerning development adoption commercial competitiveness environment friendly technology furthermore financial sector development enhances environmental globalization need properly regulated,3,-4.7991195,-11.082308
57,Enhancing resource efficiency through the utilization of the green bond market: An empirical analysis of Asian economies,http://dx.doi.org/10.1016/j.resourpol.2023.104623,abstractthis research explores effect green bond across involved asian economy empirical result indicate positive connection green issuance suggesting increase green bond corresponds significant short long improvement surprisingly negative relationship observed gdp growth implying economic expansion may contribute heightened consumption study highlight favorable renewable power generation driven sustainability renewable energy source nevertheless challenge arise poverty ratio consumer price index impeding adoption efficient furthermore cell phone penetration initially benefit negative correlation emerges long due increased non renewable energy consumption light finding study recommends practical policy sustainable development including promoting green bond targeted investment renewable energy initiative address economic disparity encouraging efficient practice,6,-7.741574,-8.235139
58,Research on the evolution of China's photovoltaic technology innovation network from the perspective of patents,http://dx.doi.org/10.1016/j.esr.2024.101309,abstractphotovoltaic pv low carbon energy crucial mitigating climate change achieving sustainable development largest total number pv patent world lack core technology restricted innovative development pv therefore necessary clarify current pv accumulation better catch key area clearly describe structural characteristic pv network study us patent pv data past year incopat global patent database analysis structural characteristic network perspective one mode two mode network using social network sna result show leading pv enterprise basically formed relatively stable internal collaboration network development expanded rapidly strong stamen development pv many innovative pv technique developed leading enterprise research development r pv among patent applicant strong kinship investment relationship dominant province participating pv increasing significantly network influenced leading node eastern coastal province pioneer r pv pv technological patent applicant city changed local cross regional high value area basically concentrated eastern coastal region scattered spatial characteristic cross regional present triangular spatial structure yangtze river delta pearl river delta beijing tianjin hebei core conclusion provide patent information support scientific research energy conservation emission reduction achieve low carbon goal also provide reference policy formulation renewable energy development green development strategy,3,4.6596317,-3.843028
59,Recent advancement and assessment of green hydrogen production technologies,http://dx.doi.org/10.1016/j.rser.2023.113941,abstracthydrogen energy garnered substantial support government public positioning pivotal future fuel source however commercial realisation face significant hurdle including slow infrastructure growth high cost producing clean hydrogen uniquely emphasis different colour code hydrogen rarely discussed literature date hydrogen method classified colour code green hydrogen produced renewable source wind solar desirable option green hydrogen across various sector expected surge comprehensively evaluates major hydrogen method based cost environmental technological maturity recent data confirm increased cost competitiveness scalability green hydrogen technology cost green hydrogen declined significantly making competitive blue hydrogen produced fossil fuel carbon capture also scrutinises several recent hydrogen technology highlighting advantage disadvantage technological readiness among solid oxide electrolysis cell soec currently outperforms others anion exchange membrane aem electrified steam methane reforming esmr also showing promise also succinctly summarises global progress hydrogen infrastructure policy spotlighting diverse colour code hydrogen discussing crucial takeaway implication future offer comprehensive overview hydrogen energy landscape unique focus enriches literature enhances understanding hydrogen promising energy source,6,-1.9577363,6.5040736
60,"Modeling the linkage between climate-tech, energy transition, and CO2 emissions: Do environmental regulations matter?",http://dx.doi.org/10.1016/j.gr.2023.04.003,abstractthe transition conventional energy clean energy ultimate strategy reduce global co emission regard climate technology climate tech pave way toward achieving capability required promote alternative energy energy saving addition environmental regulation support technological upgrading energy transition emission reduction promote sustainable development view study investigates climate technology climate tech energy transition co emission european union eu member country examine role environmental regulation relationship climate tech energy transition co emission empirical conducted based international panel data eu country ranging common correlated effect mean group cce employed estimate coefficient variable outcome indicate climate tech energy transition mitigate environmental degradation reducing carbon emission additionally environmental regulation found effective monitoring controlling tool significantly reduce co emission moreover economic growth urbanization variable contribute increasing co emission thus negatively affecting environmental sustainability causal demonstrates decision making trend related climate tech energy transition environmental regulation influence co emission conversely strategy coping co emission climate change affect energy transition environmental regulation light analytical finding paper proposes eu country vigorously develop climate related green technology promote energy transition process along implementation environmental regulation sustainable development,1,-5.0028825,-9.462579
