index,Name,DOI,Abstract,cluster,TSNE1,TSNE2
61,"Green innovation, foreign investment and carbon emissions: a roadmap to sustainable development via green energy and energy efficiency for BRICS economies",http://dx.doi.org/10.1080/13504509.2023.2268569,abstractin contemporary time emerging economy intended achieve higher economic growth via foreign direct investment technological however due increased environmental challenge economy adopting green energy key source environmental recovery net zero emission present study investigates influence fdi technological green energy trade carbon emission brics economy study also considers role economic expansion identifying environmental kuznets curve ekc using several panel diagnostic cointegration test study validates slope heterogeneity existence cointegration variable due non normal data dispersion study us novel moment quantile regression bootstrap quantile regression used robustness result examined asserted presence ekc hypothesis region initial growth enhances emission reaching threshold level emission level tends reduce environmental quality improves besides study observed foreign trade technological key driver environmental degradation indicator significantly enhances pollution emission contrast foreign investment energy renewable electricity output renewable consumption significantly improve environmental quality declining carbon emission following empirical result policy recommendation asserted enhanced investment renewable energy sector attracting foreign investment sustainable development,6,-6.527361,-10.157069
62,A short review on generation of green fuel hydrogen through water splitting,http://dx.doi.org/10.1016/j.ijhydene.2022.09.264,abstracthydrogen considered promising clean renewable energy carrier attractive alternative fossil fuel potential cheapest way produce hydrogen involving water splitting either light electricity vital involved water splitting hydrogen evolution reaction requires efficient catalyst lower large overpotential value therefore development earth abundant photocatalysts electrocatalysts high activity long stability hydrogen generation gain major attention present summarizes mechanism hydrogen via water splitting utilizing different metal based metal free photocatalysts electrocatalysts different strategy adopted improve catalytic activity electrocatalysts photocatalysts water splitting discussed finally challenge future scope hydrogen evolution reaction briefly summarized,4,-5.4657507,0.740719
63,Novel Pt-carbon core-shell decorated hierarchical CoMo2S4 as efficient electrocatalysts for alkaline/seawater hydrogen evolution reaction,http://dx.doi.org/10.1016/j.cej.2023.145348,abstractelectrochemical water electrolysis prominent green hydrogen fuel tailored nanostructures based electrocatalysts high priority hydrogen herein fabricated carbon core supported efficient electrocatalyst hydrogen evolution reaction novel carbon core shell improved long durability hybrid displayed overpotentials mv achieve current density koh outstanding durability h iro employed overall seawater electrolysis application required v achieve current density additionally evaluated electronic structure mechanism using density functional theory dft calculation work illustrates possibility designing effective long lasting scalable electrocatalyst electrolysis alkaline seawater produce pure hydrogen,4,-6.430316,2.111256
64,Tuning Mass Transport in Electrocatalysis Down to Sub-5 nm through Nanoscale Grade Separation,http://dx.doi.org/10.1002/anie.202212653,nano single atom catalysis open new possibility producing green hydrogen h water electrolysis however hydrogen evolution reaction occurs characteristic reaction rate proportional potential fast generation h nanobubbles atomic interface often lead blockage site herein nanoscale separation strategy proposed tackle transport utilizing ordered three interconnected sub nm pore result reveal dcriss crossing mesopores separation allow efficient diffusion h bubble along interconnected channel support ultrafine ruthenium ru dmesopores superior level two system maximizing catalyst performance obtained ru catalyst outperforms catalyst work provides potential route fine tuning nanometer transport water electrolysis,4,-8.976402,2.04328
65,Photocatalytic H2O2 production Systems: Design strategies and environmental applications,http://dx.doi.org/10.1016/j.cej.2022.138489,abstracthydrogen peroxide h environmentally friendly versatile oxidant used chemical medical energy environmental field h sustainable safe green process however high recombination electron hole pair low visible light utilization poor product selectivity still limit practical application h previous review h generation focus photocatalysts le design strategy system stem critical step involving process e light absorption charge separation redox reaction point article introduces strategy improving h based three critical process moreover environmental application h generation including disinfection pollutant degradation discussed challenge prospect h future environmental application also envisioned,4,-10.649989,-5.4588027
66,La- and Mn-doped cobalt spinel oxygen evolution catalyst for proton exchange membrane electrolysis,http://dx.doi.org/10.1126/science.ade1499,water electrolysis potentially sustainable mean producing hydrogen unfortunately rare expensive iridium sufficiently stable oxidation catalyst efficient acidic environment chonget al report doping earth abundant cobalt oxide catalyst lanthanum manganese ion promotes activity stability acidic proton exchange membrane water electrolyzer simulation suggest lanthanum stabilizes catalyst manganese enhances conductivity bulk jake yeston,4,-7.5817184,-0.63244534
67,Arming Ru with Oxygen-Vacancy-Enriched RuO2 Sub-Nanometer Skin Activates Superior Bifunctionality for pH-Universal Overall Water Splitting,http://dx.doi.org/10.1002/adma.202206351,water electrolysis expected assimilate renewable yet energy derived electricity green h however current benchmark anodic catalyst ir ru based compound suffer severely poor dissolution resistance herein effective modification strategy proposed arming sub nanometer skin abundant oxygen vacancy interconnected ru cluster carbon hybrid microsheet denoted ru v c hm inherit high hydrogen evolution reaction activity ru importantly activate superior activity toward oxygen evolution reaction oer acid alkaline condition outstandingly achieve ultralow overpotential mv oer mv reach acidic alkaline respectively inspiringly overall water splitting driven ultrasmall cell voltage v mh mkoh respectively density functional theory calculation reveal armoring oxygen vacancy enriched exoskeleton cooperatively alter interfacial electronic structure make adsorption behavior hydrogen oxygen intermediate much close ideal level thus simultaneously speeding hydrogen evolution kinetics decreasing energy barrier oxygen release,4,-7.900285,2.0010717
68,Electrochemical C-N coupling of CO2 and nitrogenous small molecules for the electrosynthesis of organonitrogen compounds,http://dx.doi.org/10.1039/d2cs00381c,electrochemical c n coupling reaction based abundant small molecule co n attracted increasing attention new green synthetic strategy synthesis organonitrogen compound widely used organic synthesis material chemistry biochemistry traditional employed synthesis organonitrogen compound containing c n bond often requires addition metal reagent oxidant harsh condition high energy consumption environmental concern contrast electrosynthesis avoids reducing agent oxidant utilizing electron cleanest reagent reduce generation product consistent atomic economy green chemistry study present comprehensive electrosynthesis high value added organonitrogens abundant co nitrogenous small molecule n etc viathe c n coupling reaction associated fundamental concept theoretical model emerging electrocatalysts value added target product together current challenge future opportunity discussed critical greatly increase understanding electrochemical c n coupling reaction thus attract research interest fixation carbon nitrogen,4,-11.680472,-3.7949615
69,"Electrocatalytic seawater splitting: Nice designs, advanced strategies, challenges and perspectives",http://dx.doi.org/10.1016/j.mattod.2023.08.024,abstracth sufficiently high energy density combustion process emits carbon therefore appealing storable alternative fossil fuel evident advantage seawater resource available worldwide electrochemically making h seawater hold great development prospect towards global deployment h based energy plant however current water splitting technology easy task primary obstacle impurity natural seawater including halide salt magnesium salt organic matter etc readily cause electrocatalysis system shut herein present timely seawater electrolysis system lab fundamental research pilot reactor level basis representative study analyze crucial experimental detail frequently ignored seawater treatment product detection electrode assembly reactor electrolyte feeding mode etc systematically emphasize latest representative strategy catalytic material design well whether corresponding electrode genuinely stable two key quest find truly reliable exploitable electrode engineering gas release behavior kinetics high reaction rate highlighted well addition introduce valuable content like learn ocean life electrocatalytic system design conclude taking look future research direction opportunity encouraging practical application seawater electrolysis system technology,4,-3.3992393,-4.0494766
70,Strategies to save energy in the context of the energy crisis: a review,http://dx.doi.org/10.1007/s10311-023-01591-5,new technology system societal organization policy energy saving urgently needed context accelerated climate change ukraine conflict past coronavirus disease pandemic instance concern policy response could lead new lock in investing liquefied natural gas infrastructure using available fossil fuel compensate russian gas supply cut may hinder decarbonization effort energy saving solution focus actual energy crisis green alternative fossil fuel heating energy saving building transportation artificial intelligence sustainable energy implication environment society green alternative include biomass boiler stove hybrid heat pump geothermal heating solar thermal system solar photovoltaics system electric boiler compressed natural gas hydrogen also detail case study germany planning renewable energy switch developing storage compressed air emphasis technical economic aspect global energy consumption transport residential sector energy consumption reduced using renewable energy source passive design strategy analytics energy efficient building system intelligent energy monitoring electric vehicle offer highest cost per kilometer reduction lowest energy loss yet battery related issue cost weight challenging energy saved using automated networked vehicle artificial intelligence show huge potential energy saving improving weather forecasting machine maintenance enabling connectivity across home workplace transportation instance energy consumption reduced building deep neural networking electricity sector artificial intelligence automate power generation distribution transmission operation balance without human intervention enable lightning speed trading arbitrage decision eliminate need manual adjustment end user,1,1.546795,4.3982244
71,The reformation of catalyst: From a trial-and-error synthesis to rational design,http://dx.doi.org/10.1007/s12274-023-6037-8,appropriate catalyst accelerate reaction rate effectively boost efficient conversion various molecule great importance study chemistry chemical energy material environmental science therefore efficient environmentally friendly easy operate synthesis method used prepare various type catalyst although previous study reported synthesis characterization aforementioned catalyst still remain trial method without depth consideration improvement traditional synthesis method comprehensively summarize compare preparation method trial synthesis strategy structure activity relationship density functional theory dft guided catalyst rational design nanomaterials atomically dispersed catalyst also discus detail utilization nanomaterials single atom catalyst converting small molecule h co n etc value added product driven electrocatalysis photocatalysis thermocatalysis finally challenge outlook preparation efficient green catalyst conventional trial synthesis dft theory featured accordance current development,0,-10.950572,-1.6283612
72,Highly efficient adsorption and removal bio-staining dye from industrial wastewater onto mesoporous Ag-MOFs,http://dx.doi.org/10.1016/j.psep.2023.02.036,abstractadsorption effective promising approach removing pollutant wastewater many hazardous color unintentionally released water negative environment popular textile dye malachite green thus work environmentally acceptable inorganic organic metal organic framework based remove color industrial water developed sorbent analyzed first section work using sem xps xrd ft ir phpzc bet confirmed bet area g significant area later stage sorption property dye examined along effect ph sorbent dosage temperature ionic strength sorption isotherm uptake kinetics examined opposed kinetic profile isotherm profile well fit langmuir equation modeled pseudo second order rate equation outcome demonstrated mostly adsorbed onto adsorbent electrostatic attraction force hydrogen bonding exchange pore filling mmol g found greatest adsorption effectiveness onto adsorbent e g adsorbent dosage ph temperature four adsorption process parameter tuned using box behnken design bbd methodology rsm δh δs δg dye endothermically spontaneously extracted using adsorbent according specification five cycle adsorption desorption synthesised adsorbent demonstrates exceptional render ability cyclability produced adsorbent efficacy purifying wastewater sample laboratory assessed proof concept study mechanism interaction could take place π π interaction pore filling h bonding electrostatic interaction mesoporous adsorbent offered simple effective way handle water filtering industrial wastewater management according research work first explain remove dye wastewater sample using adsorbent,4,-0.1643264,12.274192
73,"Environmental impact of renewable energy source based electrical power plants: Solar, wind, hydroelectric, biomass, geothermal, tidal, ocean, and osmotic",http://dx.doi.org/10.1016/j.rser.2022.112279,abstractrenewable energy source re based electrical power plant widely considered green clean due contribution decarbonizing energy sector apparent res produce carbon dioxide however significant negative impact environment still found ignored paper environmental impact re based power plant analyzed comprehensive considering solar thermal solar photovoltaic wind biomass geothermal hydroelectric tidal ocean current oceanic wave ocean thermal osmotic effect solar thermal power well known concentrated solar power strength weakness opportunity threat swot carried discussed re based power plant comparative swot analysis solar photovoltaic concentrated solar power plant presented comparative environmental analysis existing re based power plant tabulated various attribute attribute include limited human health noise pollution greenhouse gas emission ozone layer depletion toxification flooding inhabitant eutrophication dried river deforestation based found careful selection re electrical power plant necessary improper utilization re could harmful environment,7,1.5550045,-0.46066284
74,Bacterial Growth-Induced Tobramycin Smart Release Self-Healing Hydrogel for Pseudomonas aeruginosa-Infected Burn Wound Healing,http://dx.doi.org/10.1021/acsnano.2c05557,burn common health worldwide highly susceptible bacterial infection difficult handle ordinary dressing therefore burn repair extremely challenging clinical practice herein series self healing hydrogel qcs electrical conductivity antioxidant activity prepared basis quaternized chitosan qcs oxidized dextran tobramycin polydopamine coated polypyrrole nanowires nw schiff base cross link aminoglycoside antibiotic enable slowly released responsive ph interestingly acidic substance bacteria growth process induce release avoiding abuse antibiotic antibacterial result showed qcs hydrogel could kill high concentration ofpseudomonas aeruginosa pa staphylococcus aureus andescherichia coliin short showed bactericidal effect day agar plate diffusion experiment showing goodin vivoantibacterial activity excellent long lasting antibacterial property make suitable severely infected wound furthermore incorporation endowed hydrogel near infrared nir irradiation assisted bactericidal activity drug resistant bacteria conductivity antioxidant activity importantly pa infected burn qcs hydrogel effectively controlled inflammation level promoted collagen deposition vascular generation earlier closure compared tegaderm dressing therefore release hydrogel delivery extremely advantageous bacterial infected burn healing,4,-14.53769,0.20096909
75,The economics and the environmental benignity of different colors of hydrogen,http://dx.doi.org/10.1016/j.ijhydene.2022.02.094,abstractdue increasing greenhouse gas emission well due rapidly increasing renewable energy source electricity generation last year interest hydrogen rising hydrogen used storage renewable energy balancing whole energy system contributing decarbonization energy system especially transport sector major objective paper discus various way hydrogen depending primary energy source used moreover economic environmental performance three major hydrogen color well major barrier faster deployment fuel cell vehicle analyzed major conclusion full environmental benefit hydrogen highly dependent hydrogen method primary source used green hydrogen electricity wind pv hydro truly low emission source like blue hydrogen ccus electrolysis using electricity substantially higher emission coming close grey hydrogen another conclusion important introduce international hydrogen lower cost produce hydrogen condition best finally major open question remaining whether including external cost energy carrier hydrogen color may become economically competitive sector energy system future success hydrogen dependent technological development resulting cost reduction well future priority corresponding policy framework policy framework support shift grey green hydrogen,4,-1.261636,6.492521
76,Optimal economic scheduling of microgrids considering renewable energy sources based on energy hub model using demand response and improved water wave optimization algorithm,http://dx.doi.org/10.1016/j.est.2022.105311,abstractunpredictable nature ofrenewable energy sourcesputspower systemoperators different condition term maintaining system reliability microgrids mg provide effective problem connected renewable energy source due tuning capability flexibility study stochasticoptimization strategywas proposed participating energy operation considering dr result indicated cost decreased implementeddr program also dr program could shift energy consumption peak hour flatten load curve therefore scheduling presented operation energy carrier reserve considering security constraint power natural gas grid interconnected hub well responsive load participation using developed water wave wwo algorithm objective function aimed minimize cost source supply electrical andthermal loadsapplied proposed wwo meta algorithm inspired behavior water wave wave formed sea complex interesting relationship used solve problem algorithm encoded water wave undergoes change problemsearch spacebased three behavior propagation refraction decay water wave solution simplicity structure elitism ability escape local point due existence different search operator mutation generation led result indicated decline cost electrical thermal responsive load participation andthermal energy storage system result proposed revealed correlation electricity price natural gas consumption indicating multi carrier energy grid examined optimized simultaneously,2,9.548726,3.178874
77,"A comprehensive study of renewable energy sources: Classifications, challenges and suggestions",http://dx.doi.org/10.1016/j.esr.2022.100939,abstractrenewable energy key element sustainable environmentally friendly cost effective electricity generation official report international energy agency iea state fossil fuel usage generate electricity started decrease since along rise usage supply global energy demand research technology continuously growing order enhance performance generation especially energy conversion aim paper understand study current technology solar energy hydro energy wind energy bioenergy geothermal energy hydrogen energy several hybrid technology also studied compared improve overall performance generating electricity lastly suggestion provided purpose solve overcome challenge limitation technology term economy technical energy conversion,1,2.799186,2.926433
78,"Data-driven probabilistic machine learning in sustainable smart energy/smart energy systems: Key developments, challenges, and future research opportunities in the context of smart grid paradigm",http://dx.doi.org/10.1016/j.rser.2022.112128,abstractthe current trend indicates energy supply eventually controlled autonomous software optimizes decision making energy distribution operation new state art machine technology integral optimizing decision making energydistribution networksand system study conducted data driven probabilisticml techniquesand application tosmart energy systemsand network highlight urgency area research study focused two key area core energy technology ii case energy distribution utility core energy technology include advanced energy material energy systemsand storage device energy energy material manufacturing paradigm strategic energy planning integration renewable energy andbig dataanalytics environment investigated area energy distribution system includes energy consumption price forecasting merit order energy price forecasting consumer lifetime value cybersecurity topic power delivery utilization edge system anddistributed energy resource power transmission distribution system also briefly studied primary goal work identify common issue useful future study smooth energy distribution operation study concluded many energy perspective significant opportunity challenge noted automation used targeting energy system utility sector energy could potentially save billion billion,1,2.8489048,3.9792445
79,Semi-supervised adversarial discriminative learning approach for intelligent fault diagnosis of wind turbine,http://dx.doi.org/10.1016/j.ins.2023.119496,abstractwind turbine play crucial role renewable energy generation system frequently exposed challenging environment monitoring diagnosing potential operation essential improving reliability reducing maintenance cost supervised using data driven technique particularly deep offer viable approach developing diagnosis model however significant challenge practical wind power equipment lie scarcity annotated sample required train model effectively paper proposes semi supervised diagnosis approach specifically designed wind turbine aiming address challenge initially semi supervised deep neural network constructed using adversarial limited set annotated sample used conjunction vast amount unannotated sample health status feature present unannotated sample leveraged capture generalized representation underlying feature subsequently metric guided discriminative feature enhancement employed improve separability different manifold thereby enhancing performance semi supervised training process employing methodology becomes possible develop diagnosis superior accuracy using limited amount annotated sample comprehensive diagnosis experiment conducted wind turbine dataset revealing efficacy superiority presented methodology,2,13.912733,0.64856535
80,Model Predictive Current Control of Nine-Phase Open-End Winding PMSMs With an Online Virtual Vector Synthesis Strategy,http://dx.doi.org/10.1109/TIE.2022.3174241,abstract current hard avoid finite set predictive current fcs mpcc nine phase open end winding permanent magnet synchronous motor overcome online virtual voltage v synthesis strategy proposed article first group v without harmonic voltage component designed vector online synthesis two adjacent v zero used synthesize new v output arbitrary amplitude phase angle fundamental space two v directly selected located sector predicted reference voltage duration ratio simply calculated according angle sector way zero realized new v moreover online pulse generation algorithm corresponding new v proposed calculate symmetrical pulse sequence multiphase ow drive system without space modulator finally experimental result verified effectiveness superiority proposed strategy comparison existing fcs mpcc multiphase ow motor drive system,2,11.812851,-6.4575415
