index,Name,DOI,Abstract,cluster,TSNE1,TSNE2
21,Using electrolytic hydrogen production and energy storage for balancing a low carbon electricity grid: Scenario assessments for India,http://dx.doi.org/10.1016/j.egycc.2024.100131,abstractnuclear reactor variable renewables play significant role global energy transition provider low carbon electricity various end sector balancing power supply without modulation curtailment possible using electrolytic hydrogen plant energy storage system generation mix adopted load profile unique country study considers specific case work analysis connected water electrolysers battery storage hydrogen storage fuel cell flexible load scheme balancing based postulated long power generation scenario minimum required system size balancing estimated techno economic uncertainty assessed water electrolysers prioritized make excess power minimizing battery storage requirement scheme potentially produce substantial share low carbon hydrogen industrial decarbonization thus reducing need additional generation infrastructure,4,4.7986817,10.254082
22,"Impacts of grid-scale battery systems on power system operation, case of Baltic region",http://dx.doi.org/10.1049/stg2.12142,stability affected large utilisation renewable energy source fluctuation generation load issue effectively addressed battery energy storage system respond quickly provide high energy density different role power system addressed following optimal operation approach classification furthermore integrating be distribution grid discussed manage challenge distributed generation be aid voltage enhance frequency regulation offer black start service aggregating distributed be provide ancillary service improve economics consumer be optimise energy cost enhance reliability support self consumption renewables novel service include congestion relief system adequacy power quality enhancement moreover ancillary service provided different european country analysed finally case study conducted among three baltic dsos analyse required amendment code electricity act integration,1,8.945031,7.062511
23,Performance Evaluation Of Grid-scale Battery Energy Storage System Employing Virtual Synchronous Generator Control For Grid Code Compliance In Weak Grids,http://dx.doi.org/10.1109/SAUPEC60914.2024.10445060,abstract design testing battery energy storage system employing virtual synchronous generator vsg forming scheme rated mwh mw simulation conducted using matlab simulink simscape software function associated relay needed achieve functionality presented approach adopted apply relevant standard code associated transmission system operator tso internationally however local code context south africa used system designed compliant connection code battery energy storage facility besf connected electricity transmission system t distribution system d south africa classified category c defined system adjust reactive power output accordingly load reduction condition network furthermore local condition ride transient trip disconnect permanent two case functionality serf primary system also trip disconnect remote permanent associated functionality utilised back,1,4.759473,7.3084526
24,Early prediction of battery degradation in grid-scale battery energy storage system using extreme gradient boosting algorithm,http://dx.doi.org/10.1016/j.rineng.2023.101709,abstractthe growth battery energy storage system caused variability intermittent nature high renewable power generation network context lithium li battery occupies crucial position although faced challenge related performance battery degradation due electrochemical process battery degradation crucial factor account based potential diminish safety electrical system equipment thereby contributing increased system planning cost implies health battery need diagnosed particularly determining remaining useful life avoid unexpected cost ensure system safety therefore study aimed machine model specifically extreme gradient boosting xgboost algorithm estimate focus temperature variable aspect previously underemphasized utilizing xgboost along fine tuning hyperparameters proved accurate efficient predicting evaluation yielded promising outcome root mean square rmse mean absolute percentage mape additionally result showed could improve prediction battery within study significantly contributed optimizing planning operation well developing efficient effective maintenance strategy,5,4.0183034,-7.5824633
25,Optimal day-ahead large-scale battery dispatch model for multi-regulation participation considering full timescale uncertainties,http://dx.doi.org/10.1016/j.rser.2023.113963,abstractgrid scalebatteryintegration play important role renewable energy integration formation mitigate problem insufficient frequency peak regulation capacity faced modern power grid high wind energy uptake strategy consideringoperational risksis proposed study generation unit large scalebattery energy storagestation l coordinated participate multi type frequency controlancillaryservices fcass foroptimal performance scheduling different timescales complementarity power energy type requirement coordinated various uncertainty considered conditional value theory utilized achieve optimal mix resource regulation reserve realize minimum operation cost tackle wind power large timescale robust ro approach based budget set employed considers robustness economy help avoid conservation standard ro enhance applicability decision made simulation study comparison scheme verify effectiveness proposed optimal strategy also demonstrate l participating fcass help realize secure reliable economic power,2,10.7689,5.672056
26,Detection of False Data Injection Attacks in Battery Stacks Using Input Noise-Aware Nonlinear State Estimation and Cumulative Sum Algorithms,http://dx.doi.org/10.1109/TIA.2023.3308548,abstract battery energy storage system be vulnerable false data injection attack fdias could used disrupt state charge inaccurate negative impact system availability reliability safety cost operation article combination cumulative sum cusum algorithm improved noise aware extended kalman filter proposed detection fdias voltage current sensor battery stack series connected stack represented equivalent circuit model modeled charge reservoir state estimated using root mean squared state modified found superior traditional ekf employing article address research gap many state estimator make asymmetrical assumption noise corrupting system additionally estimate allowing fdia many alternative method unable achieve proposed algorithm detect attack voltage current sensor test case false positive utilizing compared standard ekf allowed fdia system test case,5,8.438377,-8.038286
27,Introduction to grid-scale battery energy storage system concepts and fire hazards,http://dx.doi.org/10.1002/prs.12541,world continues enact progressive climate change target renewable energy solution needed achieve goal one large lithium battery lib energy storage system forefront ensuring solar wind generated power delivered grid need however perceived hazard libs due recent event united state australia pose future success battery energy storage system multilayered approach safety thermal runaway fire hazard mitigated successful implementation approach requires cooperation education across stakeholder group break preconceived notion much learned recent fire event inform safer design operation event contributing factor share many commonality historic loss fire process safety engineer traditionally worked immense value,5,1.1923152,-9.455714
28,Optimal Grid Flexibility Assessment for Integration of Variable Renewable-Based Electricity Generation,http://dx.doi.org/10.3390/su152015032,study delf power system flexibility keen focus integration variable renewable electricity generation power grid two scenario analyzed base scenario revealed aging insufficient generation capacity frequent outage little renewable energy generation along significant loss load contrast investment scenario presented solution including raising vre capacity adding mw capacity transmission line installing mw capacity battery storage technological enhancement intervention effectively eliminated loss load reinforcing energy resilience investment ccgpp battery proved instrumental mitigating variability renewable energy improved transmission promised efficient power exchange regional elimination annualized energy spill removal ramping constraint marked significant stride enhancing power system flexibility research underscore pivotal role flexibility accommodating vre source implementing proposed optimal solution afghanistan lead way toward cleaner resilient interconnected energy future finding offer replicable framework addressing similar challenge integrating renewable energy source globally supporting transition sustainable reliable energy,1,5.905887,4.9883366
29,Electrode Blocking Due to Redox Reactions in Aluminum Chloride-Sodium Iodide Molten Salts,http://dx.doi.org/10.1149/1945-7111/acd874,iodide redox reaction molten nai alcl shown generate blocking film may limit useful cycling rate energy density molten sodium battery c experimental investigation electrode interfacial stability c reveals source reaction rate limitation electrochemical experiment electrode configuration confirm increase resistance electrode oxidation reduction current using chronopotentiometry chronoamperometry cyclic voltammetry electrochemical impedance spectroscopy formation shown depend electrode material w mo ta glassy carbon well lewis acidity molar ratio molten salt electrolyte factor amount charge given current density prior developing excessive overpotential due formation block electrode result presented guide design iodide based molten salt electrolyte electrode material battery application,5,-2.3582437,-4.9088306
30,A review of solar hybrid photovoltaic-thermal (PV-T) collectors and systems,http://dx.doi.org/10.1016/j.pecs.2023.101072,abstractin paper provide comprehensive overview state art hybrid pv collector wider system within implemented ass worldwide energy carbon mitigation potential system cover experimental computational study identify opportunity performance enhancement pathway collector implication wider deployment solar generation system level first classify main type pv collector including air based liquid based dual air water heat pipe building integrated concentrated pv collector followed presentation performance enhancement opportunity pathway collector address state art design modification next generation pv cell technology selective coating spectral splitting nanofluids beyond address wider pv system application comprising thorough solar combined heat power chp solar cooling solar combined cooling heat power cchp solar desalination solar drying solar hydrogen system includes specific potential performance cost improvement opportunity solar generation system level thermal energy storage side management subsequently set promising pv system assessed analyse carbon mitigation potential might fit within pathway global decarbonization estimated remap baseline emission curve reduced uptake solar pv technology promoted finally turn critical examination key challenge adoption pv recommendation,7,4.6840496,-0.9861108
31,"A review on global warming potential, challenges and opportunities of renewable hydrogen production technologies",http://dx.doi.org/10.1016/j.susmat.2023.e00567,abstractthis compare global warming potential renewable hydrogen technology including wind solar pv powered water electrolysis biomass gasification biogas reforming based hydrogen case compiled literature unlike many previous study discus case various country selecting technology potential commercialisation among four reviewed technology wind electrolysis performed best global warming impact kg co eq kg h whereas biogas reforming performed worst kg co eq kg h key factor contributed impact found material used construction wind solar electricity generation system wind solar pv powered electrolysis energy consumption gasification process biomass gasification methane leakage biogas highest contribution impact biogas reforming case average renewable hydrogen case demonstrated lower global warming potential compared conventional coal gasification natural gas steam methane reforming system increasing renewable hydrogen possibility hydrogen integrated existing natural gas network highlight important role renewable hydrogen future,7,0.48546714,7.197198
32,Weather Impact on Solar Farm Performance: A Comparative Analysis of Machine Learning Techniques,http://dx.doi.org/10.3390/su15010439,forecasting performance energy yield photovoltaic pv farm crucial establishing economic sustainability newly installed system present study aim develop prediction forecast installed pv system annual power generation yield performance ratio pr using three environmental parameter solar irradiance wind speed ambient air temperature three data based artificial intelligence ai technique namely adaptive neuro fuzzy inference system methodology rsm artificial neural network ann employed model developed using three year data mwp solar pv project kuzhalmannam kerala state statistical index pearson r coefficient determination r root mean squared rmse nash sutcliffe nsce mean absolute percentage mape kling gupta kge taylor diagram correlation matrix used determine accurate prediction result demonstrate precise performance ratio prediction r value rmse envisaged forecast would valuable tool policymakers solar energy researcher solar farm developer,7,7.8282003,-2.1605113
33,Voltage Sensorless Based Model Predictive Control With Battery Management System: For Solar PV Powered On-Board EV Charging,http://dx.doi.org/10.1109/TTE.2022.3213253,abstract work deal novel voltage sensorless based predictive scheme continuous quick maximum power harvesting mph photovoltaic pv solar powered board electric vehicle charging system first predictive mpc used pv predict system state horizon eliminate voltage sensor adaptive concept used deciding point accelerates process improves dynamic performance irradiation change shading pattern change partially shaded condition moreover also take care charging process using provided battery management system bm command threshold safety limit battery working principle based prediction future behavior system realizes selected horizon arbitrary number sample decided according complexity fitness function order minimize maximize fitness function predicts voltage solar pv well tune present signal force converge reach convergence criterion moreover cost current sensor lower voltage sensor therefore give fast low power oscillation steady state compared conventional technique verified developed prototype pv system different shading irradiance condition well system stability analyzed bode plot system performance also compared state art method,5,8.831356,-6.448885
34,Generation of green hydrogen using self-sustained regenerative fuel cells: Opportunities and challenges,http://dx.doi.org/10.1016/j.ijhydene.2023.03.430,abstractthe ever increasing energy depleting fossil fuel reserve rising temperature due greenhouse gas emission necessitated transition towards generation green clean energy renewable energy source solar energy one renewable energy source received significant attention owing abundance inexhaustibility however solar energy alone replace fossil fuel energy portfolio exists need develop another clean energy source potentially act alternative conventional fuel hydrogen prof ideal candidate domain sustainably generated water electrolysis powering electrolyzer using solar energy hydrogen thus synthesized net zero carbon emission suitable asset decarbonizing environment encompasses generation hydrogen using pv electrolyzer system address challenge associated overcoming drawback ensure strong position hydrogen alternative fuel energy infrastructure employing electrolyzers fueled renewable energy using hydrogen feed fuel cell study aim clarify potential constraint producing green hydrogen since area research yet fully investigated article enables encourages academic develop original solution urgently needed,6,-0.73413473,4.8151503
35,Design and investigation of PV string/central architecture for bayesian fusion technique using grey wolf optimization and flower pollination optimized algorithm,http://dx.doi.org/10.1016/j.enconman.2023.117078,abstractone essential factor current study effectively harvesting maximum power extraction mpe photovoltaic pv panel primary difficulty extracting solar power occurrence partial shading cause panel significantly increase power loss mainly occur due partially shaded solar pv kept certain critical condition obtaining maximum output power many researcher suggested connecting bypass diode anti parallel thepv moduleshotspots module avoided technique proposed bayesian fusion bft hybrid algorithm combine grey wolf gwo flower pollination algorithm fpa technique optimize performance solar panel photovoltaic pv system combination gwo fpa form ideal combination beneficial optimizing performance pv system determined work study pv string irregular pv configuration central parallel series pv string combination various partial shading pattern compared found effective reducing hotspot problem performance configuration different shading pattern compared analyzed different parameter like output power conversion article state influence partial darkening crucial point reduce sensitivity shading heaviness better understanding reader matlab simulink software used validate simulation data overall article state bft efficient reliable approach improve pv system combining two technique like gwo fpa hybrid algorithm article give clear insight researcher choosing bft gwo algorithm order decrease cost wastage energy achieving better solar panel performance,7,8.3067665,-4.866109
36,An improved genetic algorithm based fractional open circuit voltage MPPT for solar PV systems,http://dx.doi.org/10.1016/j.egyr.2022.12.088,abstractto extract maximum power solar pv maximum power point controller needed operate pv array maximum power point varying environmental condition fractional open circuit voltage simple cost effective easy implement however suffers discontinuous power supply low overcome drawback new hybrid based genetic algorithm ga proposed proposed based single decision variable reducing complexity convergence algorithm matlab simulink used test robustness proposed uniform non uniform irradiance condition performance compared perturb observe incremental conductance hybrid technique furthermore efficacy proposed also assessed commercial pv system power output one result demonstrate proposed ga improves conventional almost exhibiting average speed around minimal steady state oscillation additionally proposed also efficiently track global mpp partial shading condition offer faster speed higher fewer oscillation hybrid technique,2,9.292667,-5.1028366
37,"Solar Energy: Applications, Trends Analysis, Bibliometric Analysis and Research Contribution to Sustainable Development Goals (SDGs)",http://dx.doi.org/10.3390/su15021418,past decade energy witnessed drastic increase mainly due huge development sector growing population led global utilization renewable energy resource technology meet high fossil fuel bound end causing harm environment solar pv photovoltaic system renewable energy allows utilization solar energy directly sun meet electricity demand solar pv potential create reliable clean stable energy system future paper discus different type generation solar pv technology available well several important application solar pv system large solar pv residential solar pv green hydrogen water desalination transportation paper also provides research number solar paper application relate sustainable development goal sdgs year total paper analyzed result show paper within affordable clean energy show lack research solar energy regarding sdgs especially poverty quality education gender equality infrastructure reduced inequality peace justice strong institution research needed field create sustainable world solar pv technology,7,4.0147567,-0.042905744
38,Techno-economic assessment of green hydrogen and ammonia production from wind and solar energy in Iran,http://dx.doi.org/10.1016/j.ijhydene.2022.12.285,abstractthis paper present comprehensive technical economic assessment potential green hydrogen ammonia plant different location strong wind solar resource study organized five step first regarding wind density solar pv potential data three location chosen highest wind power solar radiation combination wind solar energy location inland spot since produced ammonia planned exported must transported export harbor south comparison base case also considered next export harbor normal solar wind potential distance export harbor second similar large hydrogen facility proton exchange membrane electrolyzers modeled location using homer pro simulation platform next produced hydrogen nitrogen obtained air separation unit supplied haber bosch process synthesize ammonia hydrogen carrier since water electrolysis requires considerable amount water specific quality suffers water scarcity paper unlike many similar research study address challenge associated water supply system hydrogen process regard fourth study assumed seawater nearest sea treated desalination plant sent location finally since study intends evaluate possibility green hydrogen export detailed piping transportation water hydrogen ammonia export harbor created last considers rout using satellite image take account pump compression station required transport medium study provides realistic cost green hydrogen ammonia ready exported considering related process involved hydrogen supply chain,6,-2.113613,2.0452526
39,Synergies and potential of hybrid solar photovoltaic-thermal desalination technologies,http://dx.doi.org/10.1016/j.desal.2023.116424,abstractsolar desalination emerged sustainable addressing global water scarcity energy water nexus particularly remote area developing country light spectrum solar device profoundly affect solar energy utilization desalination rate applicability water affordability solar photovoltaic pv solar thermal st respectively enabled variety interesting solar desalination technology resulting application usually limit integration solar desalination either electrically thermally connected paper explores co us heat electricity sun improve productivity independence various solar desalination process found coupling solar photovoltaic thermal pvt desalination could practical immediately deployable route plausibly sustainable solar desalination current solution combined electrical thermal energy output pvt panel could used synergistically catalyze improvement solar energy specific energy consumption specific water well independence application preliminary indicated lower cost pvt desalination current solar pv desalination st desalination also challenge discussed,7,3.0602207,-0.33256733
40,Research on the evolution of China's photovoltaic technology innovation network from the perspective of patents,http://dx.doi.org/10.1016/j.esr.2024.101309,abstractphotovoltaic pv low carbon energy crucial mitigating climate change achieving sustainable development largest total number pv patent world lack core technology restricted innovative development pv therefore necessary clarify current pv accumulation better catch key area clearly describe structural characteristic pv network study us patent pv data past year incopat global patent database analysis structural characteristic network perspective one mode two mode network using social network sna result show leading pv enterprise basically formed relatively stable internal collaboration network development expanded rapidly strong stamen development pv many innovative pv technique developed leading enterprise research development r pv among patent applicant strong kinship investment relationship dominant province participating pv increasing significantly network influenced leading node eastern coastal province pioneer r pv pv technological patent applicant city changed local cross regional high value area basically concentrated eastern coastal region scattered spatial characteristic cross regional present triangular spatial structure yangtze river delta pearl river delta beijing tianjin hebei core conclusion provide patent information support scientific research energy conservation emission reduction achieve low carbon goal also provide reference policy formulation renewable energy development green development strategy,3,4.1529555,-3.836636
41,Electrolysis of low-grade and saline surface water,http://dx.doi.org/10.1038/s41560-020-0550-8,powered renewable energy source solar marine geothermal wind generation storable hydrogen fuel water electrolysis provides promising path towards energy sustainability however state art electrolysis requires support associated process desalination water source purification desalinated water transportation water often contribute financial energy cost one strategy avoid operation develop electrolysers capable impure water feed directly recent development electrode material catalyst water electrolysis using low saline water significantly abundant worldwide compared potable water address associated challenge design electrolysers discus future potential approach may yield highly selective material water electrolysis presence common impurity metal ion chloride bio organism,4,-4.091207,0.2843447
