index,Name,DOI,Abstract,cluster,TSNE1,TSNE2
0,Recent advances in ammonia synthesis technologies: Toward future zero carbon emissions,http://dx.doi.org/10.1016/j.ijhydene.2022.09.061,abstractas carbon free molecule ammonia gained great global interest considered significant future candidate transition toward renewable energy numerous application ammonia fuel developed energy generation heavy transportation clean distributed energy storage clear global target achieve sustainable economy carbon neutrality therefore research effort concentrated generating cost effective renewable energy large rather fossil fuel however storage transportation still roadblock technology example hydrogen technology ammonia could replaced viable fuel clean sustainable future global energy effort government scientist lead making ammonia clean energy energy application ammonia synthesis assessed including conventional haber bosch current hydrogen technology key parameter ammonia generation also evaluated role ammonia hydrogen based fuel generation roadmap discussed future utilization energy mix ammonia generation process addressed depth including blue green ammonia generation survey ammonia synthesis catalytic material conducted role catalyst material ammonia generation compared showed ru based catalyst generated maximum ammonia h starting experiment end plan using ammonia clean energy fuel vehicle marine gas turbine well fuel cell briefly discussed recognize potential application ammonia practical future end vision energy source proposed achieve great benefit low carbon emission cost provide prospective knowledge large aspect environmental consideration ammonia herein conclude ammonia become clean energy carrier link achieve global energy economy sustainability target,6,-6.581641,6.9808016
1,Co doping regulating electronic structure of Bi2MoO6 to construct dual active sites for photocatalytic nitrogen fixation,http://dx.doi.org/10.1016/j.apcatb.2023.123057,abstractalthough nitrogen reduction reaction pnrr greenammonia synthesistechnology still encounter low adsorption n lack reaction site element doping efficient strategy regulate electronic structure catalyst nevertheless mechanism effect doping element n adsorption reaction energy barrier well unraveled taking co doped bi co bi photocatalyst density functional theory dft experiment study used investigate mechanism co doping pnrr performance bi dft result reveal co doping regulates electronic structure activates bi site co bi provides new co site thus constructing dual site pnrr benefited dual site effectively adsorption n fabricated co bi exhibit maximum generation rate μmol g h without sacrificial agent time bi furthermore detail mechanism nn adsorption hydrogenation reaction co bi also proposed according situ ftir dft result study provides promising strategy design catalyst dual site pnrr great significance popularization material system,4,-10.873858,1.4391438
2,"A Prompt Decarbonization Pathway for Shipping: Green Hydrogen, Ammonia, and Methanol Production and Utilization in Marine Engines",http://dx.doi.org/10.3390/atmos14030584,shipping reached higher level maturity term knowledge awareness decarbonization challenge carbon free carbon neutralized green fuel green hydrogen green ammonia green methanol widely discussed however little attention paid green fuel pathway renewable energy shipping paper therefore provides method green power green hydrogen green ammonia green methanol analyzes potential green fuel shipping show potential method green hydrogen green ammonia green methanol shipping hydrogen seawater electrolysis using green power ammonia green hydrogen haber bosch process methanol co using green power future green fuel bright short cost expected higher conventional fuel recommendation therefore follows improve green power reduce cost develop electrochemical fuel increase green fuel explore new strengthening research development renewable energy green fuel expanding fuel capacity ensure adequate supply low zero emission marine fuel important factor achieve carbon reduction shipping,6,-4.6858315,5.619667
3,Utilization of green ammonia as a hydrogen energy carrier for decarbonization in spark ignition engines,http://dx.doi.org/10.1016/j.ijhydene.2023.04.073,abstractrising concern dependence modern energy system fossil fuel raised requirement green alternate fuel pave roadmap sustainable energy future carbon free economy massive expectation hydrogen enabler decarbonization energy sector limited lack required infrastructure whose implementation affected issue related storage distribution hydrogen energy ammonia effective hydrogen energy carrier well established mature infrastructure long distance transportation distribution possibility green ammonia renewable energy source made suitable green alternate fuel decarbonization automotive power generation sector work engine characteristic ammonia combustion spark ignition engine reported detailed note engine fuelled pure ammonia well blend ammonia gasoline hydrogen methane higher auto ignition temperature low flammability lower flame speed ammonia detrimental effect engine characteristic could addressed either incorporating engine modification enhancing fuel quality literature show increase compression ratio improved maximum power addition hydrogen supercharged condition improved indicated challenge strategy utilization ammonia combustible fuel engine discussed considering need technical advancement well social acceptance energy green ammonia also discussed due note technique direct synthesis ammonia air water,6,-6.6302505,5.997898
4,Defective TiO2-x for High-Performance Electrocatalytic NO Reduction toward Ambient NH3 Production,http://dx.doi.org/10.1002/smll.202300291,synthesis green ammonia via electrolysis nitric oxide extraordinarily sustainable multielectron proton involved hydrogenation step well low concentration lead poor activity selectivity electrocatalysts herein reported oxygen defective nanoarray supported ti plate x behaves efficient catalyst reduction mphosphate buffered electrolyte x show competitive electrocatalytic synthesis activity maximum yield h faradaic density functional theory calculation thermodynamically faster deoxygenation protonation process x compared perfect low energy barrier x potential determining highlight greatly improved intrinsic activity addition zn battery fabricated x zn plate obtain yield h providing peak power density mw,4,-12.910054,-0.16142371
5,Techno-economic assessment of green hydrogen and ammonia production from wind and solar energy in Iran,http://dx.doi.org/10.1016/j.ijhydene.2022.12.285,abstractthis paper present comprehensive technical economic assessment potential green hydrogen ammonia plant different location strong wind solar resource study organized five step first regarding wind density solar pv potential data three location chosen highest wind power solar radiation combination wind solar energy location inland spot since produced ammonia planned exported must transported export harbor south comparison base case also considered next export harbor normal solar wind potential distance export harbor second similar large hydrogen facility proton exchange membrane electrolyzers modeled location using homer pro simulation platform next produced hydrogen nitrogen obtained air separation unit supplied haber bosch process synthesize ammonia hydrogen carrier since water electrolysis requires considerable amount water specific quality suffers water scarcity paper unlike many similar research study address challenge associated water supply system hydrogen process regard fourth study assumed seawater nearest sea treated desalination plant sent location finally since study intends evaluate possibility green hydrogen export detailed piping transportation water hydrogen ammonia export harbor created last considers rout using satellite image take account pump compression station required transport medium study provides realistic cost green hydrogen ammonia ready exported considering related process involved hydrogen supply chain,6,-2.113613,2.0452526
6,Estimating global production and supply costs for green hydrogen and hydrogen-based green energy commodities,http://dx.doi.org/10.1016/j.ijhydene.2022.12.046,abstractgreen energy commodity expected central decarbonising global energy system green energy commodity could hydrogen hydrogen based energy commodity produced renewable energy source re solar wind energy quantify cost potential hydrogen hydrogen based energy commodity ammonia methane methanol gasoline diesel kerosene country moreover evaluate total supply cost germany considering pipeline based maritime transport determine cost optimising investment operation dedicated re based country level re potential country specific weighted average cost capital analysing geographic distribution supply cost find cost dominate supply cost composition liquid easily liquefiable commodity transport cost dominate gaseous commodity case germany importing green ammonia could cost efficient domestic locally produced imported hydrogen green ammonia could supplied germany many region worldwide cost domestic cost ranging norway cheapest supplier ammonia using imported hydrogen spain could cost effective pan european hydrogen pipeline based repurposed natural gas pipeline exists,6,-3.770766,8.310531
7,"A Perspective on the Overarching Role of Hydrogen, Ammonia, and Methanol Carbon-Neutral Fuels towards Net Zero Emission in the Next Three Decades",http://dx.doi.org/10.3390/en16010280,arguably one important issue world facing currently climate change current rate fossil fuel consumption world heading towards extreme level global temperature rise immediate action taken transforming current energy system one largely based fossil fuel carbon neutral one requires unprecedented speed based current state development direct electrification future energy system alone technically challenging enough especially hard abate sector like heavy road trucking international shipping aviation leaf considerable alternative carbon neutral fuel green ammonia hydrogen renewable methanol perspective discus overarching role fuel reaching net zero emission within next three decade challenge future direction associated fuel conclude current perspective paper,6,-4.2382755,4.523247
8,The economics of global green ammonia trade - Shipping Australian wind and sunshine to Germany,http://dx.doi.org/10.1016/j.apenergy.2023.120662,abstractthis paper contributes understanding transformation global energy trade green energy carrier focusing green ammonia foreseeable first green hydrogen carrier provide comprehensive overview today ammonia trade ass scaling option trade green ammonia aim develop integrated assessment green ammonia value chain cover step green ammonia exporting country delivery harbor importing country endogenously chooses among different option determines cost minimal operation case study apply large import ammonia australia germany scenario result show green ammonia reach cost parity gray ammonia even moderate gas price necessarily blue ammonia co price high enough also provide sensitivity respect interest rate key technical economic parameter show cracking ammonia provide pure hydrogen come cost markup per mwh destination,6,-5.8007956,7.4897375
9,Techno-economic evaluation of hydrogen and ammonia as energy carriers in a multi-generation system,http://dx.doi.org/10.1016/j.enconman.2023.116670,abstractgreen hydrogen suitable energy storage increase penetration renewable energy also alternative fossil fuel however still suffers storage problem owing low volumetric energy density embrittlement low boiling point improve safety reduce cost green ammonia proposed substitute hydrogen attracted considerable attention study multi generation system proposed compare green hydrogen green ammonia energy carrier four scenario discussed performance different energy carrier constant electricity price operation compared optimal planning system formulated mixed integer linear programming evaluated using supply profile hourly objective maximize profitability reflected cumulative cash position payback result revealed hydrogen based system superior ammonia based system hydrogen based scenario cumulative cash position musd payback year cumulative cash position payback musd year respectively ammonia based scenario improve profitability recommended increase capacity hydrogen ammonia reduce capacity backup power generation,6,-6.1698837,8.987334
10,Potential-Driven Restructuring of Cu Single Atoms to Nanoparticles for Boosting the Electrochemical Reduction of Nitrate to Ammonia,http://dx.doi.org/10.1021/jacs.2c02262,restructuring ubiquitous thermocatalysis pivotal importance identify yet le explored electrocatalysis herein usingoperandox ray absorption spectroscopy conjunction advanced electron microscopy reveal restructuring synthesized n single atom nanoparticles nm electrochemical reduction nitrate ammonia green ammonia route upon combined plasma assisted oxidation nitrogen reduction subsequent aggregation single atom found occur concurrently enhancement rate driven applied potential switching v versus rhe maximum rate ammonia reach h molnh gcu h faradaic v versus rhe outperforming catalyst reported previously electrolysis aggregated nanoparticles reversibly disintegrated single atom restored n structure upon exposed ambient atmosphere mask potential induced restructuring reaction synchronous change percentage ammonia faradaic applied potential suggests nanoparticles genuine site nitrate reduction ammonia corroborated post deposited np catalyst density functional theory calculation,0,-9.236727,5.3661914
11,Sodium-Ion Battery Materials and Electrochemical Properties Reviewed,http://dx.doi.org/10.1002/aenm.201800079,electrochemical energy storage technology rapidly increasing due proliferation renewable energy source emerging market battery application property battery ideal electrical energy storage ee need yet faced constraint ability current lithium battery libs match overwhelming uncertain sodium battery sib novel class battery similar performance characteristic libs since composed earth abundant element cheaper utility battery module assembled curve lib phenomenal progression material development realized innovative strategy used material development electrochemical property cathode electrolyte combination elucidated attractive performance characteristic herein evidenced based comparative gravimetric volumetric energy density state art libs addition opportunity challenge toward commercialization herein discussed based patent data trend extensive industrial adaptation expected commercial prospect sib look promising discarded set play major role ee application,5,0.8045633,-6.442408
12,Recent Progress in Rechargeable Sodium-Ion Batteries: toward High-Power Applications,http://dx.doi.org/10.1002/smll.201805427,increasing demand renewable energy substitute traditional fossil fuel related large energy storage system ee drive development battery application today lithium battery lib trendsetter rechargeable battery dominated portable electronics electric vehicle seeking participant opportunity battery however growing concern regarding cost availability lithium sodium battery regarded ideal battery choice ee owing similar electrochemistry lib crust abundance na resource participation frequency regulation high pulse power capability essential implanted sib ee herein comprehensive overview recent advance exploration high power cathode material presented deep understanding inherent host structure sodium storage mechanism na diffusion kinetics together promising strategy promote rate performance provided work may shed light classification screening alternative high rate electrode material provide guidance design high power sib future,5,0.24418065,-7.3715525
13,Rechargeable Zinc Alkaline Anodes for Long-Cycle Energy Storage,http://dx.doi.org/10.1021/acs.chemmater.7b00754,zinc alkaline anode command significant share consumer battery market key emerging battery improved understanding electrode required long deployment kwh mwh due strict requirement performance cost safety give modern literature survey zinc alkaline anode levelized performance metric also present experimental assessment leading formulation long material characterization performance metric failure reported unique formulation cycle year shelf life per test statistical repeatability measurement made baseline design fewest additive via duplicate baseline design capacity density mah per lifetime throughput ah per report identical measurement anode improved material property via additive perturbation achieve capacity density mah per lifetime throughput ah per novel operando x ray microscopy cycling zinc paste reveals formation nanoscale zinc material cycle electrochemically replaces original structure long life ex situ elemental mapping material characterization suggest key physical process hydrogen evolution reaction growth zinc oxide nanoscale material concentration deficit oh znoh electrodeposition zn growth outside separator membrane,5,-0.97104394,-3.574398
14,Stochastic coordinated operation of wind and battery energy storage system considering battery degradation,http://dx.doi.org/10.1007/s40565-016-0238-z,battery energy storage system be promising solve problem future power system due limited lifespan high cost cost benefit trade battery effort performance thus develop battery degradation accurately represent battery degradation related cost battery operation cycling linearization proposed transform developed battery degradation mixed integer linear programming milp problem battery degradation incorporated hybrid deterministic stochastic look rolling wind bidding operation electricity simulation result show developed battery degradation effectively help extend battery life make profit wind moreover proposed rolling look strategy utilize updated wind power forecast thereby also increase wind profit,5,3.8568559,-8.268084
15,Polyanion-type electrode materials for advanced sodium-ion batteries,http://dx.doi.org/10.1016/j.mtnano.2020.100072,abstractelectrical energy storage ee exploiting secondary battery technology ideal large energy storage need due rapid growth proliferation renewable energy source emerging market battery application sodium battery sib sustainable ee option alternative lithium battery libs attracted intensive interest past decade natural abundance evenly geographical distributed na source significantly low cost environmental benignity polyanionic compound offer appealing combination rich structural diversity superior ionic conductivity high structural thermal stability convenient storage handling making competitive attractive candidate electrode material next generation energy storage system recent advancement made regarding polyanion type electrode used sib summarized elaborating intrinsic structural characteristic electrochemical property corresponding sodium storage mechanism furthermore highlight recent achievement lab na full cell prototype consist polyanion type compound one working electrode last least challenge outlook structure electrochemical performance polyanion type electrode material sib also presented provide insight facilitate practical realization sodium technology,5,-0.45248723,-6.5079417
16,Assessing new transmission and energy storage in achieving increasing renewable generation targets in a regional grid,http://dx.doi.org/10.1016/j.apenergy.2019.05.066,abstractthis study evaluates generation transmission storage capacity need achieve deep renewable energy penetration regional electricity average load approximately gw increasing renewable energy target analyzed evaluate effect realistic regional transmission upgrade energy storage cost assumption cost optimal mix generation transmission storage capacity contextual data used new york state examine electricity generation renewable energy resource wind water solar power meet electricity central finding study realistic transmission upgrade cost assumed new interzonal transmission battery storage needed cost effectively meet near renewable energy goal fact new york achieve renewable energy penetration buildout new generation capacity onshore wind gw offshore wind gw solar photovoltaics gw presence battery storage electric vehicle additional behind meter solar capacity markedly change selected generation mix achieve target compute mwh levelized cost electricity new renewable energy current generation cost renewable generation target increase beyond begin select transmission upgrade new storage capacity latter particularly battery cost continue decline anticipated deeper target marginal generation capacity would otherwise experience high curtailment primarily due supply imbalance calculate value energy storage renewable energy penetration level time higher value level however additional storage generation transmission lesser degree needed achieve longer renewable energy goal lead substantial rise total investment target computed marginal levelized cost electricity new variable renewable energy mwh compared mwh suggesting alternative integration measure likely necessary high penetration rate,1,5.779982,5.669542
17,Fiber Optic Sensing Technologies for Battery Management Systems and Energy Storage Applications,http://dx.doi.org/10.3390/s21041397,application fiber optic sensor battery monitoring increasing due growing need enhanced battery management system accurate state estimation goal discus advancement enabling practical implementation battery internal parameter measurement including local temperature strain pressure refractive index general operation well external measurement temperature gradient vent gas sensing thermal runaway imminent detection reasonable matching discussed fiber optic sensor different range capability battery system three level scale namely electric vehicle heavy duty electric truck battery pack battery system advantage fiber optic sensor electrical sensor discussed electrochemical stability issue fiber implanted battery critically assessed also includes estimated sensing system cost typical fiber optic sensor identifies high interrogation cost one limitation practical deployment battery finally future perspective considered implementation fiber optic high value battery application energy storage detection prediction system,5,5.1780186,-9.404141
18,Challenges and Mitigation Measures in Power Systems with High Share of Renewables-The Australian Experience,http://dx.doi.org/10.3390/en15020429,australia one leading country energy transition largest power system intended securely operate variable renewable generation high inertia synchronous condenser battery energy storage system forming converter technology supporting transformation secure operation synchronous condenser enabled mw solar wind generation state south australia reaching minimum demand mw battery energy storage system demonstrated benefit cutting cost consumer also essential service contingency fast frequency synthetic inertia high current supporting capability provided new development strengthen integration new renewable energy hub manuscript provides comprehensive overview based australian experience power system overcoming expected challenge continuing integrate secure low cost clean energy,1,7.16147,6.7265687
19,State-of-Charge Balancing Control for ON/OFF-Line Internal Cells Using Hybrid Modular Multi-Level Converter and Parallel Modular Dual L-Bridge in a Grid-Scale Battery Energy Storage System,http://dx.doi.org/10.1109/ACCESS.2018.2885083,abstract cell state charge balancing within battery energy storage system key optimizing capacity utilization many cell balancing strategy proposed however complexity slow convergence remain key issue paper present two strategy achieve balancing among cell main balancing strategy mb using cascaded hybrid modular multi level converter supplementary balancing strategy sb using cascaded parallel modular dual l bridge cpmdlb monitoring individual cell reduction count loss achieved integrating individual cell l bridge instead h bridge simulation result demonstrate satisfactory performance proposed balancing strategy balancing convergence point cell module achieved min cell prioritized mb work without sb cpmdlb min cpmbs work together sb cpmdlb duration required reduces similarly substantial improvement balancing convergence point cell module achieved module prioritized mb work together sb cpmdlb duration needed reach balancing convergence point cell module achieved min,2,4.750491,11.087482
20,Investigating the role of nuclear power and battery storage in Hungary's energy transition using hourly resolution electricity market simulations,http://dx.doi.org/10.1016/j.heliyon.2024.e29841,new hungarian nuclear unit decrease co emission electricity generation limit condition renewables battery lack profit price arbitrage basis thus capability must sold reserve sufficient return nuclear power plant must prepared flexible operation provide balancing service despite nuclear solar capacity hungary remains net electricity importer hourly resolution simulation sensitivity renewables advantage detailed necps,2,7.66586,9.748884
